{"related_usc": [{"number": "5948", "detail": "(j)(1)", "title": "5"}, {"number": "801", "detail": "(a)(1)(A)", "title": "5"}, {"number": "635g", "detail": "(a)", "title": "12"}, {"number": "2776", "detail": "(c)", "title": "22"}, {"number": "1517", "detail": "(b)", "title": "31"}, {"number": "1101", "detail": "(56)", "title": "36"}, {"number": "1103", "title": "36"}, {"number": "6", "title": "36"}, {"number": "3020", "detail": "(l)", "title": "38"}, {"number": "1622", "detail": "(d)", "title": "50"}, {"number": "1641", "detail": "(c)", "title": "50"}, {"number": "1703", "detail": "(c)", "title": "50"}], "related_laws": [{"isprivate": "false", "number": "510", "congress": "101"}, {"isprivate": "false", "number": "106", "congress": "104"}, {"isprivate": "false", "number": "107", "congress": "104"}, {"isprivate": "false", "number": "164", "congress": "104"}, {"isprivate": "false", "number": "270", "congress": "105"}, {"isprivate": "false", "number": "554", "congress": "106"}, {"isprivate": "false", "number": "174", "congress": "107"}, {"isprivate": "false", "number": "287", "congress": "108"}, {"isprivate": "false", "number": "447", "congress": "108"}], "title": "EXECUTIVE COMMUNICATIONS, ETC.", "content": [{"text": "  Under clause 8 of rule XII, executive communications were taken from \nthe Speaker's table and referred as follows:\n\n       2891. A letter from the Acting Administrator, AMS, \n     Department of Agriculture, transmitting the Department's \n     final rule -- Almonds Grown in California; Revision to \n     Requirements Regarding Credit for Promotion and Advertising \n     [Docket No. FV05-981-1 IFR] received June 30, 2005, pursuant \n     to 5 U.S.C. 801(a)(1)(A); to the Committee on Agriculture.\n       2892. A letter from the Acting Under Secretary, Rural \n     Development, Department of Agriculture, transmitting the \n     Department's final rule -- Renewable Energy Systems and \n     Energy Efficiency Improvements Grant, Guaranteed Loan, and \n     Direct Loan Program (RIN: 0570-AA50) received July 11, 2005, \n     pursuant to 5 U.S.C. 801(a)(1)(A); to the Committee on \n     Agriculture.\n       2893. A communication from the President of the United \n     States, transmitting a request for a FY 2006 budget \n     amendments for the Departments of Agriculture and Health and \n     Human Services; the Environmental Protection Agency; \n     International Assistance Programs; the National Aeronautics \n     and Space Administration; and the Small Business \n     Administration; (H. Doc. No. 109--49); to the Committee on \n     Appropriations and ordered to be printed.\n       2894. A letter from the Acting Comptroller, Department of \n     Defense, transmitting a report of a violation of the \n     Antideficiency Act by the Defense Contract Management Agency \n     (DCMA), Case Number 03-02, pursuant to 31 U.S.C. 1517(b); to \n     the Committee on Appropriations.\n       2895. A letter from the Solicitor General, Department of \n     Justice, transmitting notice that the Department will not \n     appeal the district court's order in the case American Civil \n     Liberties Union v. Norman Mineta, No. 04-0262; to the \n     Committee on Appropriations.\n       2896. A letter from the Acting Under Secretary for \n     Acquisition, Technology and Logistics, Department of Defense, \n     transmitting a report presenting the specific amounts of \n     staff-years of technical effort to be allocated for each \n     defense Federally Funded Research and Development Center \n     (FFRDC) during FY 2006, pursuant to Public Law 108--287, \n     section 8028(e); to the Committee on Armed Services.\n       2897. A letter from the Principal Deputy Under Secretary \n     for Personnel and Readiness, Department of Defense, \n     transmitting a report on the Department's status and results \n     of the ``National Call to Service'' program for Fiscal Year \n     2004, pursuant to Section 531(e) of the Bob Sump National \n     Defense Authorization Act of 2003; to the Committee on Armed \n     Services.\n       2898. A letter from the Under Secretary for Acquisition, \n     Technology and Logistics, Department of Defense, transmitting \n     certified materials supplied to the Defense Base Closure and \n     Realignment Commission, pursuant to Public Law 101--510, \n     section 2903(c)(6) and 2914(b)(1); to the Committee on Armed \n     Services.\n       2899. A letter from the Principal Deputy Under Secretary \n     for Personnel and Readiness, Department of Defense, \n     transmitting authorization of the enclosed list of officers \n     to wear the insignia of the grade of real admiral (lower \n     half) accordance with title 10, United States Code, section \n     777; to the Committee on Armed Services.\n       2900. A letter from the Principal Deputy Under Secretary \n     for Personnel and Readiness, Department of Defense, \n     transmitting authorization of the enclosed list of officers \n     to wear the insignia of the grade of major general in \n     accordance with title 10, United States Code, section 777; to \n     the Committee on Armed Services.\n       2901. A letter from the Under Secertary for Personnel and \n     Readiness, Department of Defense, transmitting a letter on \n     the approved retirement of General Richard B. Myers, United \n     States Air Force, and his advancement to the grade of general \n     on the retired list; to the Committee on Armed Services.\n       2902. A letter from the Under Secretary for Acquisition, \n     Technology and Logistics, Department of Defense, transmitting \n     certified materials supplied to the Defense Base Closure and \n     Realignment Commission; to the Committee on Armed Services.\n       2903. A letter from the Under Secretary for Acquisition, \n     Technology and Logistics, Department of Defense, transmitting \n     certified materials supplied to the Defense Base Closure and \n     Realignment Commission; to the Committee on Armed Services.\n       2904. A letter from the President and Chairman, Export-\n     Import Bank of the United States, transmitting the annual \n     report to Congress on the operations of the Export-Import \n     Bank of the United States for Fiscal\n\n\n     Year 2004, pursuant to 12 U.S.C. 635g(a); to the Committee on \n     Financial Services.\n       2905. A letter from the Administrator, FNS, Department of \n     Agriculture, transmitting the Department's final rule -- \n     Child and Adult Care Food Program: Permanent Agreements for \n     Day Care Home Providers (RIN: 0584-AD69) received June 17, \n     2005, pursuant to 5 U.S.C. 801(a)(1)(A); to the Committee on \n     Education and the Workforce.\n       2906. A letter from the Deputy Assistant Secretary for \n     Labor-Management Programs, Department of Labor, transmitting \n     the Annual Report of the U.S. Department of Labor's Office of \n     Labor-Management Standards (OLMS), covering OLMS activities \n     from October 1, 2003 through September 30, 2004; to the \n     Committee on Education and the Workforce.\n       2907. A letter from the Director, Regulations Policy and \n     Mgmt. Staff, FDA, Department of Health and Human Services, \n     transmitting the Department's final rule -- Medical Devices; \n     Medical Device Reporting; Confirmation of Effective Date \n     [Docket No. 2004N-0527] received July 6, 2005, pursuant to 5 \n     U.S.C. 801(a)(1)(A); to the Committee on Energy and Commerce.\n       2908. A letter from the Director, Regulations Policy and \n     Mgmt. Staff, FDA, Department of Health and Human Services, \n     transmitting the Department's final rule -- Beverages: \n     Bottled Water [Docket No. 2004N-0416] received July 1, 2005, \n     pursuant to 5 U.S.C. 801(a)(1)(A); to the Committee on Energy \n     and Commerce.\n       2909. A letter from the Director, Regulations Policy and \n     Mgmt. Staff, FDA, Department of Health and Human Services, \n     transmitting the Department's final rule -- Electronic \n     Products; Performance Standard for Diagnostic X-Ray Systems \n     and Their Major Components [Docket No. 2001N-0275] (RIN: \n     0910-AC34) received June 29, 2005, pursuant to 5 U.S.C. \n     801(a)(1)(A); to the Committee on Energy and Commerce.\n       2910. A letter from the Regulations Coordinator, CMS, \n     Department of Health and Human Services, transmitting the \n     Department's final rule -- Medicaid Program; Time Limitation \n     on Recordkeeping Requirements Under the Drug Rebate Program \n     [CMS-2175-F] (RIN: 0938-AN55) received April 6, 2005, \n     pursuant to 5 U.S.C. 801(a)(1)(A); to the Committee on Energy \n     and Commerce.\n       2911. A letter from the Regulations Coordinator, Department \n     of Health and Human Services, transmitting the Department's \n     final rule -- Federal Policy for the Protection of Human \n     Subjects ---- received June 22, 2005, pursuant to 5 U.S.C. \n     801(a)(1)(A); to the Committee on Energy and Commerce.\n       2912. A letter from the Attorney Advisor, NHTSA, Department \n     of Transportation, transmitting the Department's final rule -\n     Federal Motor Vehicle Safety Standards; Tire Pressure \n     Monitoring Systems; Controls and Displays [Docket No. NHTSA \n     2005-20586] (RIN: 2127-AJ23) received April 12, 2005, \n     pursuant to 5 U.S.C. 801(a)(1)(A); to the Committee on Energy \n     and Commerce.\n       2913. A communication from the President of the United \n     States, transmitting notification that the national emergency \n     with respect to Liberia is to continue in effect beyond July \n     22, 2005, pursuant to 50 U.S.C. 1622(d); (H. Doc. No. 109--\n     48); to the Committee on International Relations and ordered \n     to be printed.\n       2914. A letter from the Acting Assistant Secretary for \n     Legislative Affairs, Department of State, transmitting \n     certifiation of a proposed technical assistance agreement for \n     the manufacture of significant military equipment abroad \n     (Transmittal No. DDTC 016-05), pursuant to 22 U.S.C. 2776(c); \n     to the Committee on International Relations.\n       2915. A letter from the Acting Assistant Secretary for \n     Legislative Affairs, Department of State, transmitting \n     certifiation of a proposed technical assistance agreement for \n     the export of defense articles or defense services sold \n     commercially to Japan (Transmittal No. DDTC 023-05), pursuant \n     to 22 U.S.C. 2776(c); to the Committee on International \n     Relations.\n       2916. A letter from the Acting Assistant Secretary for \n     Legislative Affairs, Department of State, transmitting \n     certification of a proposed transfer of major defense \n     equipment from the Government of the Netherlands to the \n     Government of Portugal (Transmittal No. RSAT-01-05), pursuant \n     to 22 U.S.C. 2776(c); to the Committee on International \n     Relations.\n       2917. A letter from the Principal Deputy Under Secretary, \n     Personnel and Readiness, Department of Defense, transmitting \n     a report on the audit of the American Red Cross for the \n     financial year ending June 30, 2004, pursuant to 36 U.S.C. 6; \n     to the Committee on International Relations.\n       2918. A letter from the Deputy Director, Defense Security \n     Cooperation Agency, transmitting a report in accordance with \n     Section 25(a)(6) of the Arms Export Control Act(AECA), \n     describing and analyzing services performed during FY 2004 by \n     full-time USG employees who are performing services for which \n     reimbursement is provided under Section 21(a) or Section \n     43(b) of the AECA; to the Committee on International \n     Relations.\n       2919. A letter from the Acting Director, Defense Security \n     Cooperation Agency, transmitting the annual report on \n     Military Assistance, Military Exports, and Military Imports \n     for Fiscal Year 2004, as required by Section 655 of the \n     Foreign Assistance Act of 1961 (FAA), as enacted 10 February \n     1996, by Section 1324 of Pub. L. 104-106, and 21 July 1996, \n     by Section 148 of Pub. L. 104-164; to the Committee on \n     International Relations.\n       2920. A letter from the Secretary, Department of the \n     Treasury, transmitting as required by section 401(c) of the \n     National Emergencies Act, 50 U.S.C. 1641(c), and section \n     204(c) of the International Emergency Economic Powers Act, 50 \n     U.S.C. 1703(c), a six-month periodic report of the national \n     emergency with respect to Liberia that was declared in \n     Executive Order 13348 of July 22, 2004; to the Committee on \n     International Relations.\n       2921. A letter from the Deputy Assistant Secretary For \n     Export Administration, Department of Commerce, transmitting \n     the Department's final rule -- Expansion of the Country Scope \n     of the License Requirements that Apply to Chemical/Biological \n     (CB) Equipment and Related Technology; Amendments to CB-\n     Related End-User/End-Use and U.S. Person Controls [Docket No. \n     050401091-5091-01] (RIN: 0694-AD37) received April 18, 2005, \n     pursuant to 5 U.S.C. 801(a)(1)(A); to the Committee on \n     International Relations.\n       2922. A letter from the Administrator, National Nuclear \n     Security Administration, Department of Energy, transmitting a \n     report regarding calendar year 2004 sales to designated Tier \n     III countries of computers capable of operating at a speed in \n     excess of a specified number of million theoretical \n     operations per second (MTOPS) by companies that participated \n     in the Advanced Simulation & Computing (ASC) Program of the \n     Department; to the Committee on International Relations.\n       2923. A letter from the Acting Assistant Secretary for \n     Legislative Affairs, Department of State, transmitting a \n     report providing information on steps taken by the U.S. \n     Government to bring about an end to the Arab League boycott \n     of Israel and to expand the process of normalization between \n     Israel and the Arab League countries, as requested in Section \n     535 Division D of the Foreign Operations, Export Financing, \n     and Related Programs Appropriations Act for Fiscal Year 2005 \n     (Pub. L. 108-447); to the Committee on International \n     Relations.\n       2924. A letter from the Acting Assistant Secretary for \n     Legislative Affairs, Department of State, transmitting a \n     report describing conditions in Hong Kong that are of \n     interest to the United States, covering the period from April \n     1, 2004 to March 31, 2005, pursuant to Public Law 104--107 \n     section 576; to the Committee on International Relations.\n       2925. A letter from the Acting Assistant Secretary for \n     Legislative Affairs, Department of State, transmitting \n     pursuant to Section 620C(c) of the Foreign Assistance Act of \n     1961, as amended, and in accordance with section 1(a)(6) of \n     Executive Order 13313, a report prepared by the Department of \n     State and the National Security Council on the progress \n     toward a negotiated solution of the Cyprus question covering \n     the period February 1, 2005 through March 31, 2005; to the \n     Committee on International Relations.\n       2926. A letter from the Acting Chief Counsel, Office of \n     Foreign Assests Control, Department of Treasury, transmitting \n     the Department's final rule -- Alphabetical Listing Of \n     Blocked Persons, Specially Designated Nationals, Specially \n     Designated Terrorists, Specially Designated Global \n     Terrorists, Foreign Terrorist Organizations, and Specially \n     Designated Narcotics Traffickers ---- received June 27, 2005, \n     pursuant to 5 U.S.C. 801(a)(1)(A); to the Committee on \n     International Relations.\n       2927. A letter from the Acting Director, Office of \n     Personnel Management, transmitting a report on the \n     Physicians' Comparability Allowance Program for fiscal year \n     2005, pursuant to 5 U.S.C. 5948(j)(1); to the Committee on \n     Government Reform.\n       2928. A letter from the Secretary, Department of Education, \n     transmitting the semiannual report of the activities of the \n     Office of Inspector General during the six month period \n     ending March 31, 2005, pursuant to 5 U.S.C. app. (Insp. Gen. \n     Act) section 5(b); to the Committee on Government Reform.\n       2929. A letter from the Political Personnel & Advisory \n     Comm. Mgmt. Spec., Department of Health and Human Services, \n     transmitting a report pursuant to the Federal Vacancies \n     Reform Act of 1998; to the Committee on Government Reform.\n       2930. A letter from the Attorney General, Department of \n     Justice, transmitting the semiannual report on the activities \n     of the Office of Inspector General for the period October 1, \n     2004 through March 31, 2005, pursuant to 5 U.S.C. app. (Insp. \n     Gen. Act) section 5(b); to the Committee on Government \n     Reform.\n       2931. A letter from the Asst. Secretary for Administration \n     & Management, Department of Labor, transmitting a report \n     pursuant to the Federal Vacancies Reform Act of 1998; to the \n     Committee on Government Reform.\n       2932. A letter from the Chairman, Federal Communications \n     Commission, transmitting a copy of the Commission's Fiscal \n     Year 2004 Inventory of Commercial Activities, pursuant to \n     Public Law 105--270; to the Committee on Government Reform.\n       2933. A letter from the Office of the District of Columbia \n     Auditor, transmitting a report entitled, ``Letter Report: \n     Sole Source Agreements Issued by the Executive Office of the \n     Mayor and Office of the City Administrator Failed to Comply \n     with Procurement Law and Regulations''; to the Committee on \n     Government Reform.\n       2934. A letter from the Senior Vice President, Tennessee \n     Valley Authority, transmitting the Authority's second annual \n     report with respect to fiscal years 2000 through 2004, \n     pursuant to Public Law 107--174 section 203(a); to the \n     Committee on Government Reform.\n       2935. A letter from the Rules Administrator, Bureau of \n     Prisons, Department of\n\n\n     Justice, transmitting the Department's final rule -- Over-\n     the-Counter (OTC) Medications: Technical Correction [BOP-\n     1129-F] (RIN: 1120-AB29) received June 1, 2005, pursuant to 5 \n     U.S.C. 801(a)(1)(A); to the Committee on the Judiciary.\n       2936. A letter from the Rules Administrator, Bureau of \n     Prisons, Department of Justice, transmitting the Department's \n     final rule -- Clarifying of Release Gratuities--Release \n     Transportation Regulations to More Closely Conform to \n     Statutory Provisions [BOP-1108-F] (RIN: 1120-AB21) received \n     June 1, 2005, pursuant to 5 U.S.C. 801(a)(1)(A); to the \n     Committee on the Judiciary.\n       2937. A letter from the Deputy Assistant Attorney General, \n     Office of the Attorney General, Department of Justice, \n     transmitting the Department's final rule -- Inspection of \n     Records Relating to Depiction of Sexually Explicit \n     Performances [Docket No. CRM 103; AG Order No. 2765-2005] \n     (RIN: 1105-AB05) received May 31, 2005, pursuant to 5 U.S.C. \n     801(a)(1)(A); to the Committee on the Judiciary.\n       2938. A letter from the Director of Publications and \n     Information Technology, American Council of Learned \n     Societies, transmitting the Council's Annual Report for the \n     years 2000-2001 through 2002-2003, pursuant to 36 U.S.C. \n     1101(56) and 1103; to the Committee on the Judiciary.\n       2939. A letter from the Attorney Advisor, NHTSA, Department \n     of Transportation, transmitting the Department's final rule \n     -- Federal Motor Vehicle Safety Standards; Child Restraint \n     Systems [Docket No. NHTSA-03-15351] (RIN: 2127-AJ40) received \n     April 19, 2005, pursuant to 5 U.S.C. 801(a)(1)(A); to the \n     Committee on Energy and Commerce.\n       2940. A letter from the National Ombudsman, Small Business \n     Administration, transmitting a copy of the Administration's \n     Office of the National Ombudsman's Annual Report on COngress \n     for fiscal year 2004; to the Committee on Small Business.\n       2941. A letter from the Principal Deputy Under Secretary \n     for Personnel and Readiness, Department of Defense, \n     transmitting the Department's annual report on entitlement \n     transfers of basic educational assistance to eligible \n     dependents under the Montgomery GI Bill (MGIB), pursuant to \n     38 U.S.C. 3020(l); jointly to the Committees on Veterans' \n     Affairs and Armed Services.\n       2942. A letter from the Secretary, Department of Health and \n     Human Services, transmitting the Department's report \n     entitled, ``National Coverage Determinations for Fiscal Year \n     2003,'' pursuant to Public Law 106--554 section522(a); \n     jointly to the Committees on Ways and Means and Energy and \n     Commerce.\n", "kind": "Unknown", "speaker": "Unknown", "itemno": 0, "turn": -1}, {"kind": "linebreak", "speaker_bioguide": null, "text": "                          ____________________\n\n\n", "turn": -1, "speaker": "None", "itemno": 1}], "header": {"chamber": "House", "num": "99", "extension": false, "year": "2005", "vol": "151", "pages": "H6202-H6204", "wkday": "Wednesday", "day": "20", "month": "July"}, "doc_title": "EXECUTIVE COMMUNICATIONS, ETC.", "id": "CREC-2005-07-20-pt1-PgH6202-4"}